{
  "blocked_reasons": [],
  "class_distribution": {
    "EXPIRED": 47922,
    "STOP_FIRST": 146567,
    "TARGET_FIRST": 146567
  },
  "coefficients": {
    "atr_14": -0.032253432396695716,
    "close": 0.013453321705632178,
    "direction_is_long": -0.012036961227424293,
    "direction_is_short": 0.012036961227424293,
    "of_delta": 0.00016363918111431366,
    "of_delta_sum_14": -0.001028683785663659,
    "of_minutes_present": 0.007291483667626977,
    "of_trades": 0.02467118501226514,
    "of_trades_sum_14": -0.17050700379751957,
    "of_volume": 0.02766297568813643,
    "of_volume_sum_14": -0.13519846060421709,
    "range_over_atr": 0.03418078000633729,
    "ret_1": 0.002301215572694573,
    "ret_14": -0.013704475334619496,
    "ret_4": 0.0031438733077021113,
    "ret_8": -0.005905883671328894,
    "seconds_with_trades": 0.08507727131343076,
    "volume_30m": 0.02766297568813643
  },
  "created_at": "2026-09-07T14:01:41.737940Z",
  "dataset_id": "f9d3c1b0d02da255a89dcbd01033106c51da389e25bb38f3307b9b1dc0c6e966",
  "dataset_version": "gc-30m-real-dataset-builder-0.1.0",
  "feature_names": [
    "atr_14",
    "close",
    "of_delta",
    "of_delta_sum_14",
    "of_minutes_present",
    "of_trades",
    "of_trades_sum_14",
    "of_volume",
    "of_volume_sum_14",
    "range_over_atr",
    "ret_1",
    "ret_14",
    "ret_4",
    "ret_8",
    "seconds_with_trades",
    "volume_30m",
    "direction_is_long",
    "direction_is_short"
  ],
  "feature_schema_version": "gc-30m-real-feature-schema-0.1.0",
  "final_evaluation_scope": "TEST_ONLY",
  "fit_scope": "TRAIN_ONLY",
  "intercept": -0.01181180924622105,
  "label_version": "gc-outcome-contract-label-0.1.0",
  "metrics": {
    "test_accuracy": 0.4397054737427063,
    "test_balanced_accuracy": 0.3327682056539053,
    "test_binary_accuracy": 0.5571165601555987,
    "test_expected_r_per_candidate": -0.0007492867863052171,
    "test_expected_r_per_selected_trade": -0.00545887276095643,
    "test_selected_trade_rate": 0.13726035009724924,
    "test_target_precision": 0.49114372469635625,
    "test_target_recall": 0.15305760359578915,
    "validation_accuracy": 0.4247681590273772,
    "validation_balanced_accuracy": 0.33524189735777693,
    "validation_binary_accuracy": 0.5764964280960199,
    "validation_expected_r_per_candidate": 0.0024142730405804147,
    "validation_expected_r_per_selected_trade": 0.01251103047035199,
    "validation_selected_trade_rate": 0.19297155788259307,
    "validation_target_precision": 0.49701080708208784,
    "validation_target_recall": 0.22708409938540736
  },
  "model_type": "REGULARIZED_LOGISTIC_RESEARCH_BASELINE",
  "model_version": "regularized-logistic-research-baseline-0.1.0",
  "promotion_allowed": false,
  "run_id": "2bcf697a07beaa16d487a4f3df83491b826500be1f55a0acaf2bd2efa293414d",
  "run_version": "gc-first-real-model-run-0.1.0",
  "selected_threshold": 0.5599999999999999,
  "selection_scope": "VALIDATION_ONLY",
  "split_summary": {
    "TEST": 57584,
    "TRAIN": 238398,
    "VALIDATION": 45074
  },
  "status": "TRAINED",
  "threshold_selection_metric": "validation_expected_r_per_candidate",
  "training_parameters": {
    "epochs": 220,
    "l2": 0.01,
    "learning_rate": 0.08,
    "negative_classes": "STOP_FIRST_OR_EXPIRED",
    "solver": "in_repo_batch_gradient_descent",
    "target_class": "TARGET_FIRST"
  },
  "training_policy_version": "baseline-training-policy-0.1.0"
}
